### ISSUE TITLE
datum gateway can't connect to datum server

### ISSUE THREAD

**Issue by elliedev80** [OCEAN-xyz/datum_gateway#160]
I'm using datum_gateway at aarch64. build from github tag v0.4.0beta

datum_gateway_config.json is configured in this way

"datum": {
		"pool_host" : "default.mine.ocean.xyz",
		"pool_port" : 3101,
		"pool_pass_workers": true,
		"pool_pass_full_users": true,
		"pooled_mining_only": false
	}

it seems that my datumgw can.t connect to datum server [2]
mining locally seems working however it doesn't connect to datum server

here how tcpdump shows [3]

[1]
git clone https://github.com/OCEAN-xyz/datum_gateway.git -b v0.4.0beta

commit cd7b7a30d681b58420bc24d09ea561a620cbd4ac (HEAD, tag: v0.4.0beta)
Merge: a8f02be 91ea754
Author: Luke Dashjr <luke-jr+git@utopios.org>
Date:   Wed Jul 16 19:28:19 2025 +0000

    Merge branch '0.3.x'

[2]
datum-1  | 2025-10-26 17:00:29.786 [                                        main]  INFO: Waiting on DATUM server... 15
datum-1  | 2025-10-26 17:00:29.787 [                      datum_coinbaser_thread] DEBUG: Coinbaser thread active
datum-1  | 2025-10-26 17:00:29.787 [                            datum_api_thread]  INFO: API listening on address (any) port 7152
datum-1  | 2025-10-26 17:00:29.930 [                   datum_protocol_send_hello] DEBUG: Signing handshake 245 bytes
datum-1  | 2025-10-26 17:00:29.931 [                   datum_protocol_send_hello] DEBUG: Sending handshake init (357 bytes)
datum-1  | 2025-10-26 17:00:30.238 [                       datum_protocol_client] DEBUG: recv() issue. protocol_state=0, n=0, errno=11 (Resource temporarily unavailable)
datum-1  | 2025-10-26 17:00:30.239 [                       datum_protocol_client] DEBUG: DATUM Protocol Thread is exiting.
datum-1  | 2025-10-26 17:00:30.787 [              datum_protocol_start_connector] DEBUG: Starting DATUM v0.3.2-beta client...
datum-1  | 2025-10-26 17:00:30.787 [                                        main]  INFO: Waiting on DATUM server... 13
datum-1  | 2025-10-26 17:00:30.841 [                   datum_protocol_send_hello] DEBUG: Signing handshake 348 bytes
datum-1  | 2025-10-26 17:00:30.843 [                   datum_protocol_send_hello] DEBUG: Sending handshake init (460 bytes)
datum-1  | 2025-10-26 17:00:31.787 [                                        main]  INFO: Waiting on DATUM server... 12
datum-1  | 2025-10-26 17:00:32.787 [                                        main]  INFO: Waiting on DATUM server... 11
datum-1  | 2025-10-26 17:00:33.787 [                                        main]  INFO: Waiting on DATUM server... 10
datum-1  | 2025-10-26 17:00:34.787 [                                        main]  INFO: Waiting on DATUM server... 9
datum-1  | 2025-10-26 17:00:35.787 [                                        main]  INFO: Waiting on DATUM server... 8
datum-1  | 2025-10-26 17:00:36.788 [                                        main]  INFO: Waiting on DATUM server... 7
datum-1  | 2025-10-26 17:00:37.788 [                                        main]  INFO: Waiting on DATUM server... 6
datum-1  | 2025-10-26 17:00:38.788 [                                        main]  INFO: Waiting on DATUM server... 5
datum-1  | 2025-10-26 17:00:39.788 [                                        main]  INFO: Waiting on DATUM server... 4
datum-1  | 2025-10-26 17:00:40.788 [                                        main]  INFO: Waiting on DATUM server... 3
datum-1  | 2025-10-26 17:00:41.788 [                                        main]  INFO: Waiting on DATUM server... 2
datum-1  | 2025-10-26 17:00:42.788 [                                        main]  INFO: Waiting on DATUM server... 1
datum-1  | 2025-10-26 17:00:43.788 [                                        main]  INFO: Waiting on DATUM server... 0
datum-1  | 2025-10-26 17:02:23.227 [                       datum_protocol_client] DEBUG: recv() issue. protocol_state=0, n=0, errno=11 (Resource temporarily unavailable)
datum-1  | 2025-10-26 17:02:23.227 [                       datum_protocol_client] DEBUG: DATUM Protocol Thread is exiting.

[3]
sudo tcpdump -nn -i eth0 -vvv host default.mine.ocean.xyz
tcpdump: listening on enP4p65s0, link-type EN10MB (Ethernet), snapshot length 262144 bytes
18:27:12.123217 IP (tos 0x0, ttl 51, id 17168, offset 0, flags [DF], proto TCP (6), length 52)
    20.157.66.196.3101 > 192.168.1.11.59002: Flags [F.], cksum 0x5227 (correct), seq 854132045, ack 1783019549, win 501, options [nop,nop,TS val 901588475 ecr 2492320787], length 0
18:27:12.123815 IP (tos 0x0, ttl 63, id 3196, offset 0, flags [DF], proto TCP (6), length 52)
    192.168.1.11.59002 > 20.157.66.196.3101: Flags [F.], cksum 0x193b (incorrect -> 0xeec2), seq 1, ack 1, win 502, options [nop,nop,TS val 2492346229 ecr 901588475], length 0
18:27:12.285511 IP (tos 0x0, ttl 51, id 17169, offset 0, flags [DF], proto TCP (6), length 52)
    20.157.66.196.3101 > 192.168.1.11.59002: Flags [.], cksum 0xee20 (correct), seq 1, ack 2, win 501, options [nop,nop,TS val 901588638 ecr 2492346229], length 0
18:27:31.998096 IP (tos 0x0, ttl 63, id 39708, offset 0, flags [DF], proto TCP (6), length 60)
    192.168.1.11.59026 > 20.157.66.196.3101: Flags [S], cksum 0x1943 (incorrect -> 0xa557), seq 2331049820, win 64240, options [mss 1460,sackOK,TS val 2492366103 ecr 0,nop,wscale 7], length 0
18:27:32.153646 IP (tos 0x0, ttl 51, id 0, offset 0, flags [DF], proto TCP (6), length 60)
    20.157.66.196.3101 > 192.168.1.11.59026: Flags [S.], cksum 0x1b7b (correct), seq 709801410, ack 2331049821, win 64260, options [mss 1378,sackOK,TS val 901608507 ecr 2492366103,nop,wscale 7], length 0
18:27:32.154127 IP (tos 0x0, ttl 63, id 39709, offset 0, flags [DF], proto TCP (6), length 52)
    192.168.1.11.59026 > 20.157.66.196.3101: Flags [.], cksum 0x193b (incorrect -> 0x4268), seq 1, ack 1, win 502, options [nop,nop,TS val 2492366259 ecr 901608507], length 0
18:27:32.158097 IP (tos 0x0, ttl 63, id 39710, offset 0, flags [DF], proto TCP (6), length 479)
    192.168.1.11.59026 > 20.157.66.196.3101: Flags [P.], cksum 0x1ae6 (incorrect -> 0x9e30), seq 1:428, ack 1, win 502, options [nop,nop,TS val 2492366263 ecr 901608507], length 427
18:27:32.313683 IP (tos 0x0, ttl 51, id 57517, offset 0, flags [DF], proto TCP (6), length 52)
    20.157.66.196.3101 > 192.168.1.11.59026: Flags [.], cksum 0x401a (correct), seq 1, ack 428, win 501, options [nop,nop,TS val 901608667 ecr 2492366263], length 0
